{"colors":{"primary":{"anthracite":{"value":"#0a0a0a","usage":"Primary background, depth, substance","contrast":{"white_on_anthracite":"20.4:1"}},"white":{"value":"#ffffff","usage":"Primary text on dark, clean surfaces","contrast":{"white_on_anthracite":"20.4:1","synthesis_blue_on_white":"8.2:1","neutral_gray_on_white":"4.8:1"}},"synthesis-blue":{"value":"#0066ff","usage":"Primary actions, links, emphasis"}},"status":{"critical":{"value":"#dc2626","usage":"Critical issues, high-impact problems"},"warning":{"value":"#f59e0b","usage":"Medium priority, caution states"},"success":{"value":"#10b981","usage":"Positive metrics, completed actions"}},"functional":{"neutral":{"value":"#6b7280","usage":"Secondary text, disabled states","contrast":{"neutral_gray_on_white":"4.8:1"}},"light-bg":{"value":"#f8f9fa","usage":"App background, light surfaces"},"border":{"value":"#e9ecef","usage":"Borders, dividers, subtle definition"},"dark-text":{"value":"#2d3748","usage":"Primary text color for light backgrounds"}}},"typography":{"fontFamily":"-apple-system, BlinkMacSystemFont, 'Segoe UI', Roboto, sans-serif","scale":{"display":{"size":"72px","weight":"300","lineHeight":"0.9"},"h1":{"size":"48px","weight":"400","lineHeight":"1.1"},"h2":{"size":"36px","weight":"400","lineHeight":"1.2"},"h3":{"size":"28px","weight":"500","lineHeight":"1.3"},"h4":{"size":"20px","weight":"600","lineHeight":"1.4"},"body-large":{"size":"18px","weight":"400","lineHeight":"1.6"},"body":{"size":"16px","weight":"400","lineHeight":"1.6"},"body-small":{"size":"14px","weight":"400","lineHeight":"1.6"},"caption":{"size":"12px","weight":"500","lineHeight":"1.4"}}},"spacing":{"base":"8px","scale":{"xs":"8px","sm":"16px","md":"24px","lg":"32px","xl":"48px","2xl":"64px","3xl":"80px"}},"animation":{"duration":{"micro":"150ms","standard":"200ms","page":"300ms","data":"400ms"},"easing":{"out":"ease-out","in-out":"ease-in-out"}},"breakpoints":{"mobile":"640px","tablet":"1024px","desktop":"1200px"}}